{
  "release_id": "bench-certified-release:sha256:8297d53d12e17aeb236c9659e6f4d056a57088894dcff174cd3414d8f6538ac1",
  "schema": "studio.bench.certified-release.v1",
  "created_at": "2026-07-19T17:12:46.824Z",
  "purpose": "rule_change_qualification",
  "runtime_deployable": false,
  "registration": {
    "receipt": {
      "path": "bench/rule-changes/ko-kinship-address-context/registration.json",
      "content_id": "sha256:52eabe2f5c0493553042ea1892d7a5de85953a24e5dd8b6b93f151a3212bc3f2",
      "bytes": 7479
    },
    "registration_id": "bench-rule-change-registration:sha256:8ca90db19a68f84a0f409323d0de12fa9a888dd9fa6d84fd9ca5a695dbea430d"
  },
  "side": "without",
  "system_id": "1321-openai-audio-translation-rule-change",
  "configuration": {
    "config_id": "bench-config:sha256:c0182300de81ad3de5ba588ccee6a25e60a23ed2a928299e0c9ab67f842b8206",
    "config": {
      "model": "whisper-1",
      "provider": {
        "id": "openai",
        "operation": "audio_translation",
        "response_format": "verbose_json",
        "temperature": 0,
        "timeout_ms": 120000,
        "max_response_bytes": 1048576
      },
      "reviewed_memory": {
        "rule_content_id": null
      }
    }
  },
  "evaluation_sources": [
    {
      "clip_id": "Ux-TMWnmntM",
      "authority": {
        "path": "bench/prompts/gold-drafter-v1/manifest.json",
        "content_id": "sha256:c6ae65505304bc7c3e4f8bc76598ba26bd6cd001ff0fcc71291df2703bda5430",
        "bytes": 2550
      },
      "artifact": {
        "path": "public/demo/runs/run-006/clip.mp4",
        "content_id": "sha256:4f60799f8a71c7c6a19d05067eb7b74b74a9d0f2a32000ba6c1e341273c1905f",
        "bytes": 3465772
      }
    },
    {
      "clip_id": "local-eval-ko-control-01",
      "authority": {
        "path": "bench/packs/hard-ko-v1/pack.json",
        "content_id": "sha256:12041b80b72c3d6135a26fc68eb6820288dd345cc2d9ed1921ac5226700e3adb",
        "bytes": 4839
      },
      "artifact": {
        "path": ".studio/scratch/control-01/gyumindInterviewTest.mp4",
        "content_id": "sha256:2502c559cb77870dfddbedf074d7535c6c04cd9501b61435f7b910fd85c076e7",
        "bytes": 5776236
      }
    },
    {
      "clip_id": "local-eval-ko-control-02",
      "authority": {
        "path": "bench/packs/hard-ko-v1/pack.json",
        "content_id": "sha256:12041b80b72c3d6135a26fc68eb6820288dd345cc2d9ed1921ac5226700e3adb",
        "bytes": 4839
      },
      "artifact": {
        "path": ".studio/scratch/control-02/hyunseokInterviewTest.mp4",
        "content_id": "sha256:48607e221bf5b12409e453171414667c9917c6eae7bdafa0497e2ffee76e4fc1",
        "bytes": 9374608
      }
    }
  ],
  "reviewed_memory": {
    "accepted_materialization": null,
    "candidate_rule": null
  },
  "host_context": {
    "context_id": "bench-host-context:sha256:053638d7a4414581427f407ae4b57b7bc42d1f5bd43b598727b8fce8cd840686",
    "schema": "studio.bench.certified-host-context.v1",
    "system_id": "1321-openai-audio-translation-rule-change",
    "config_id": "bench-config:sha256:c0182300de81ad3de5ba588ccee6a25e60a23ed2a928299e0c9ab67f842b8206",
    "config": {
      "model": "whisper-1",
      "provider": {
        "id": "openai",
        "operation": "audio_translation",
        "response_format": "verbose_json",
        "temperature": 0,
        "timeout_ms": 120000,
        "max_response_bytes": 1048576
      },
      "reviewed_memory": {
        "rule_content_id": null
      }
    },
    "reviewed_memory": {
      "accepted_materialization": null,
      "entries": []
    }
  }
}
