{
  "release_id": "bench-certified-release:sha256:1bafaf5c9d5e03780c2ffe4e513aba80b06ce568385f613bbb7b606b332df71f",
  "schema": "studio.bench.certified-release.v1",
  "created_at": "2026-07-19T20:24:06.173Z",
  "purpose": "rule_change_qualification",
  "runtime_deployable": false,
  "registration": {
    "receipt": {
      "path": "bench/rule-changes/ko-kinship-address-context-provider-authorized/registration.json",
      "content_id": "sha256:d14aec39ec44c441a01af7cbf79e81c7c0a2d1712df675701466f53d0f67db6c",
      "bytes": 7897
    },
    "registration_id": "bench-rule-change-registration:sha256:222b65152093755812937f287139756e185b2bef94fc9556edcc4cee3b95ca8f"
  },
  "side": "with",
  "system_id": "1321-openai-audio-translation-rule-change",
  "configuration": {
    "config_id": "bench-config:sha256:28ef658e553a684152d1a4de0e1ba99cc28705b0b7b78ebb84ffa2086e86cf9b",
    "config": {
      "model": "whisper-1",
      "provider": {
        "id": "openai",
        "operation": "audio_translation",
        "response_format": "verbose_json",
        "temperature": 0,
        "timeout_ms": 120000,
        "max_response_bytes": 1048576
      },
      "reviewed_memory": {
        "rule_content_id": "sha256:365d886cdd82f867d244c538f622b66c3addf4d6a36e42ef543dde57292157a7"
      }
    }
  },
  "evaluation_sources": [
    {
      "clip_id": "2o0f-V4uoMg",
      "authority": {
        "path": "bench/packs/hard-ko-provider-authorized-v1/pack.json",
        "content_id": "sha256:e3115116111c404488253c71bf1dae6a4213551e5f71571ae9cead672fe592cb",
        "bytes": 4258
      },
      "artifact": {
        "path": "bench/packs/hard-ko-provider-authorized-v1/2o0f-V4uoMg.m4a",
        "content_id": "sha256:a0e78a490a27b228713963a5d8f3c992748e1ae3505b53550fd5dd4dfca9e514",
        "bytes": 973872
      }
    },
    {
      "clip_id": "Ni5rBtowdnI",
      "authority": {
        "path": "bench/packs/hard-ko-provider-authorized-v1/pack.json",
        "content_id": "sha256:e3115116111c404488253c71bf1dae6a4213551e5f71571ae9cead672fe592cb",
        "bytes": 4258
      },
      "artifact": {
        "path": "bench/packs/hard-ko-provider-authorized-v1/Ni5rBtowdnI.m4a",
        "content_id": "sha256:b1de8455ae1dd9bb4b5c60db30062280b0010b160e26a4217cd7528e6c5d9193",
        "bytes": 742145
      }
    },
    {
      "clip_id": "Ux-TMWnmntM",
      "authority": {
        "path": "bench/packs/hard-ko-provider-authorized-v1/pack.json",
        "content_id": "sha256:e3115116111c404488253c71bf1dae6a4213551e5f71571ae9cead672fe592cb",
        "bytes": 4258
      },
      "artifact": {
        "path": "public/demo/runs/run-006/clip.mp4",
        "content_id": "sha256:4f60799f8a71c7c6a19d05067eb7b74b74a9d0f2a32000ba6c1e341273c1905f",
        "bytes": 3465772
      }
    }
  ],
  "reviewed_memory": {
    "accepted_materialization": null,
    "candidate_rule": {
      "proposal": {
        "path": "memory/review/proposals/f87565b6e254e1ff92883206630130a597d92f3c9e41cdb0b0317b762070c8d3.json",
        "content_id": "sha256:125328f5eb983e33bb16feb357327f93b81c11f2258a0d3039fa96c677a709c8",
        "bytes": 1471
      },
      "proposal_id": "memory-proposal:sha256:f87565b6e254e1ff92883206630130a597d92f3c9e41cdb0b0317b762070c8d3",
      "proposal_content_id": "sha256:09856cd6d4d5a006c607bfa8b11e1adc5dad6f1b93aa27cf0f5c2acc87730d2b",
      "rule_content_id": "sha256:365d886cdd82f867d244c538f622b66c3addf4d6a36e42ef543dde57292157a7",
      "namespace": "language/ko/rules",
      "key": "ko.kinship-address-context",
      "value": {
        "instruction": "Treat bare Korean social address forms such as 누나, 오빠, 형, and 언니 as forms of address, not proof of a family relationship. Translate a family relationship only when surrounding speech supplies explicit kinship evidence, including terms such as 친누나 or 매형."
      }
    }
  },
  "host_context": {
    "context_id": "bench-host-context:sha256:0c0b4379a0a7869328f5dd73a2256e47d8d4563877922ae0ea33743d4c76eab3",
    "schema": "studio.bench.certified-host-context.v1",
    "system_id": "1321-openai-audio-translation-rule-change",
    "config_id": "bench-config:sha256:28ef658e553a684152d1a4de0e1ba99cc28705b0b7b78ebb84ffa2086e86cf9b",
    "config": {
      "model": "whisper-1",
      "provider": {
        "id": "openai",
        "operation": "audio_translation",
        "response_format": "verbose_json",
        "temperature": 0,
        "timeout_ms": 120000,
        "max_response_bytes": 1048576
      },
      "reviewed_memory": {
        "rule_content_id": "sha256:365d886cdd82f867d244c538f622b66c3addf4d6a36e42ef543dde57292157a7"
      }
    },
    "reviewed_memory": {
      "accepted_materialization": null,
      "entries": [
        {
          "namespace": "language/ko/rules",
          "kind": "rule",
          "key": "ko.kinship-address-context",
          "value": {
            "instruction": "Treat bare Korean social address forms such as 누나, 오빠, 형, and 언니 as forms of address, not proof of a family relationship. Translate a family relationship only when surrounding speech supplies explicit kinship evidence, including terms such as 친누나 or 매형."
          },
          "proposal_id": "memory-proposal:sha256:f87565b6e254e1ff92883206630130a597d92f3c9e41cdb0b0317b762070c8d3",
          "rule_content_id": "sha256:365d886cdd82f867d244c538f622b66c3addf4d6a36e42ef543dde57292157a7",
          "status": "qualification_candidate"
        }
      ]
    }
  }
}
